,created_at,original,translated
0,18/9/2020,"¡Creo en Oruro!

¡Gracias Oruro por el cariño, gracias por recibirnos con los brazos abiertos, gracias por creer en el cambio! Les pido que me presten su voto 5 años, me comprometo a devolverles una Bolivia productiva, con empleo, una Bolivia grande.

#CreoEnOruro #CreoEnVos","I believe in Oruro!

Oruro Thank you for the love, thanks for welcoming us with open arms, thank you for believing in change! I ask you to give me your vote 5 years, I promise to restore a productive Bolivia, with employment, Bolivia big.

#CreoEnOruro #CreoEnVos"
1,18/9/2020,"La gente está cansada de la vieja política, de la corrupción y los negociados.

Es tiempo de comenzar a construir una nueva Bolivia, una bolivia productiva, con trabajo. Una Bolivia con esperanza, que mire a futuro.

Con tu voto, vamos a llevar tu voz al poder.

#CreoEnMiGente #CreoEnVos #TuVozAlPoder","People are tired of the old politics, corruption and negotiated.

It's time to start building a new Bolivia, Bolivia productive with work. A Bolivia with hope, to look into the future.

With your vote, we will carry your voice power.

#CreoEnMiGente #CreoEnVos #TuVozAlPoder"
2,19/9/2020,"EL VOTO ÚTIL DEBE SER PARA QUE BOLIVIA CAMBIE DE VERDAD

Mucha gente me pregunta qué pienso del voto útil y si es la forma de encarar una elección presidencial. Acá les dejo mi respuesta.

Desde el 2009, los bolivianos fuimos a las urnas pensando en sacarnos de encima el peso de la dictadura del MAS y Evo Morales. Por eso se ha pensado en distintas formas de unidad y en el voto útil.

Pero hay que tener bien claro a quién debemos entregarle el voto útil. Si el voto útil es para que Evo Morales no vuelva, entonces no podemos votar por la vieja política que pactó y convivió con Evo Morales.

El tremendo error de Jeanine Áñez fue dejarse intimidar por los bloqueos del MAS, que le impusieron un montón de cosas, entre ellas liberar a los asesinos de los cívicos de Montero, por ejemplo. Y por eso pregunto: ¿Carlos Mesa es garantía de que el MAS y Evo Morales no vuelvan? Por su puesto que no, entre Mesa y el MAS hay una historia escrita de acuerdos y convivencias, por eso digo que entre masismo y mesismo hay solo una letra de diferencia.

Ese sería un voto útil para Evo Morales.

Nosotros creemos en el voto útil, pero un voto útil para la gente, esa que quiere que este país cambie realmente.

Si vas a votar útil, preguntate antes ¿Útil para quién? Y asegúrate de que la respuesta sea útil para vos, que querés cambiar Bolivia.

#CreoEnMiGente #CreoEnVos #TuVozAlPoder","VOTE MUST BE HELPFUL TO BOLIVIA CHANGE OF TRUTH

Many people ask me what I think of the useful vote and if the way to face a presidential election. Here I give you my answer.

Since 2009, Bolivians went to the polls thinking about get us off the weight of the dictatorship of the MAS and Evo Morales. That's why you thought of different ways of unity and the useful vote.

But we must be clear about who we give the useful vote. If the useful vote is for Evo Morales does not return, then we can not vote for the old policy that covenant and lived with Evo Morales.

Jeanine tremendous error Áñez was being intimidated by blockades of the MAS, which imposed a lot of things, including free the murderers of civic Montero, for example. And why I ask: Carlos Mesa is a guarantee that the MAS and Evo Morales will not return? Of course not, between Mesa and MAS is a written history of agreements and cohabitation, why I say that between masismo and mesismo there is only one letter apart.

That would be a useful vote for Evo Morales.

We believe in the useful vote, but a useful vote for people, that you want this country really change.

If you go to useful vote, ask yourself before right Useful for whom? And make sure the answer is useful for you, who want to change Bolivia.

#CreoEnMiGente #CreoEnVos #TuVozAlPoder"
3,19/9/2020,"¡Mis valientes cochalas nos recibieron hoy con la esperanza de quienes saben que vamos a lograr cambiar este país!
Gracias a esas mujeres, a esos jóvenes, a esos hombres comprometidos con su pueblo que compartieron con nosotros una caravana multitudinaria, llena de alegría y entusiasmo.
Me comprometo con ustedes a llevar la voz de Cochabamba al poder.
#CreoEnCochabamba #CreoEnVos #TuVozAlPoder","My cochalas brave welcomed us today in the hope of those who know that we will achieve change this country!
Thanks to these women, these young people, these men committed to their people who shared with us a massive caravan, full of joy and enthusiasm.
I agree with you to bring the voice of Cochabamba to power.
#CreoEnCochabamba #CreoEnVos #TuVozAlPoder"
4,20/9/2020,"En mi tierra aprendí que a todos los bolivianos se los trata como hermanos, que al que llega se le abre las puertas y el corazón, que si querés trabajar no importa de dónde seas si tenés buenas intenciones, que no existe mejor silpancho que el cochala, ni gente de mayor ñeque que los mineros potosinos.

Por décadas han intentado sembrar odio entre bolivianos, pero con la pluralidad en la que vivimos en Santa Cruz es imposible.

Aquí tu amigo es paceño, tu madre es beniana (como la mía), no falta un cochala en tu frater o el yo te invito de algún Tarijeño, siempre habrá alguien que añora volver a la hermosa Sucre, o dejó Oruro por falta de oportunidades.

Aquí, Pando, Beni, La Paz, Cochabamba, Oruro, Potosí, Chuquisaca, Tarija y Santa Cruz, trabajan por un objetivo común que es salir adelante.

Con gorra o con chulo, igual somos bolivianos.

¡Buen domingo para todos!","In my learned land that treats all Bolivians as brothers, that which comes he opens the door and heart, if you want to work no matter where you are if you have good intentions, there is no better silpancho the cochala or more people ñeque that potosinos miners.

For decades they have tried to sow hatred between Bolivians, but with the plurality in which we live in Santa Cruz is impossible.

Here your friend is paceño, your mother is beniana (like mine), not missing a cochala in your Frater or I invite some Tarijeño, there will always be someone who yearns to return to the beautiful Sucre, or left Oruro due to lack of opportunities .

Here, Pando, Beni, La Paz, Cochabamba, Oruro, Potosí, Chuquisaca, Tarija and Santa Cruz, working for a common goal which is to get ahead.

With cap or cool, as we Bolivians.

Good Sunday to all!"
5,20/9/2020,"¡SOMOS UN EQUIPO, TODO POR BOLIVIA!!

Yo no tengo un equipo, nosotros ¡somos un equipo, y qué equipango!

Un grupo de gente que se mueve por valores, principios, consecuencia, lealtad, esperanza, rebeldía y amor por Bolivia.

Todos sabemos que estamos en las buenas y malas, que estamos para ayudarnos y levantarnos cuando caemos, pero siempre entre todos. Eso ¡No lo tiene nadie!

Hoy a cada uno de ustedes, incluidos los que no salen en la foto, les agradezco por creer en este proyecto, por creer en mí. Ya falta poco, cumpliremos este sueño común y haremos de Bolivia un nuevo país

¡Vamos que se puede!","WE ARE A TEAM, ALL FOR BOLIVIA !!

I have not a team, we we are a team, and what equipango!

A group of people moving by values, principles, consequently, loyalty, hope, rebellion and love for Bolivia.

We all know we are in good times and bad, we are to help and get up when we fall, but always together. That Do not have one!

Today each of you, including those not appear in the photo, I thank you for believing in this project, for believing in me. In a short while, we will fulfill this common dream and we will make a new country Bolivia

Let's go, it's possible!"
6,20/9/2020,"Soy un hombre como vos, soy hermano, soy hijo, soy padre.
Soy un hombre de familia, un hombre soñador. Me gusta trabajar en equipo, me gusta la unidad.

Este 18 de octubre, te pido que me prestes tu voto, en 5 años te devolveré un país productivo, un país con empleos, una nueva Bolivia.

Con tu voz al poder, vamos a cambiar este país.

#CreoEnVos #TuVozAlPoder","I am a man like you, am brother, I am the son, I am a father.
I am a family man, a man dreamer. I like working in a team, I like the unit.

October 18th, I ask you to lend me your vote, in 5 years will restore a productive country, a country with jobs, a new Bolivia.

With your voice to power, we will change this country.

#CreoEnVos #TuVozAlPoder"
7,21/9/2020,"¡Los jóvenes no son el futuro, son el presente de Bolivia!

Gracias Cochabamba por creer en nosotros, gracias a esos jóvenes valientes que lucharon hasta recuperar nuestra libertad, gracias a esas mujeres y a esos hombres que confían en este proyecto, que quieren cambiar Bolivia.

¡Creo en Cochabamba, creo en vos!

#TuVozAlPoder","The youth are not the future, are the present of Bolivia!

Cochabamba thanks for believing in us, thanks to those brave young men who fought to regain our freedom, thanks to these women and these men who trust in this project, they want to change Bolivia.

I believe in Cochabamba, I believe in you!

#TuVozAlPoder"
8,22/9/2020,"¡Gracias al sector salud por proclamarme como su futuro presidente!

Tienen mi compromiso, trabajaremos unidos para que los bolivianos tengan un sistema de salud digno, para que ustedes tengan las condiciones de trabajo que necesitan.

Esta pandemia desnudó las carencias de un sistema que estuvo olvidado durante 14 años, un sistema que no le interesa arreglar a los políticos pero que nosotros vamos a trasnformar.

¡Con trabajo y compromiso lo haremos posible!

#CreoEnLaSalud #CreoEnVos #TuVozAlPoder","Thank you to the health sector as its future president proclaim myself!

You have my commitment, we will work together so that Bolivians have a health system worthy, that you have working conditions they need.

This pandemic bare the shortcomings of a system that was forgotten for 14 years, a system that is not interested in fixing the politicians but we will trasnformar.

With work and commitment we will make it possible!

#CreoEnLaSalud #CreoEnVos #TuVozAlPoder"
9,22/9/2020,"SOMOS EL VOTO ÚTIL PARA LA DEMOCRACIA.

Después de 21 días en las calles tenemos un compromiso con nuestro pueblo: consolidar nuestra democracia.

No permitiremos que el MAS vuelva, no permitiremos que este país vuelva a estar en manos de delincuentes. Nosotros no pactamos, no nos vendemos, no somos serviles al socialismo.

#CreoEnVos #TuVozAlPoder","WE ARE THE VOTE HELPFUL FOR DEMOCRACY.

After 21 days on the streets we are committed to our people: to consolidate our democracy.

We will not allow the MAS back, we will not allow this country to be back in the hands of criminals. We agreed we do not, we do not sell, we are not subservient to socialism.

#CreoEnVos #TuVozAlPoder"
10,23/9/2020,"¡LA CHURA TARIJA CREE!

Gracias a toda esa gente tarijeña que hoy salió a las calles a reafirmar su compromiso con Bolivia.

Con su voz al poder lograremos construir un mejor país; un país sin corruptos, un país descentralizado, un país productivo.

Tarija merece mejores días, merece oportunidades reales de desarrollo para que su gente pueda vivir de actividades como el turismo y la producción vitivinicola volver a levantarse, pueda tener nuevas fuentes de empleo","The CHURA TARIJA BELIEVE!

Tarijeña thank all those people who took to the streets today to reaffirm their commitment to Bolivia.

With his voice to the power we can build a better country; a country without corrupt, decentralized country, a country productive.

Tarija deserves better days, deserves real development opportunities for their people can live activities such as tourism and wine production to rise again, may have new jobs"
11,23/9/2020,"¡CREO EN TARIJA!

Creo en mejores días para la chura, un departamento que necesita oportunidades de desarrollo, necesita una verdadera descentralización para poder explotar el turismo, la producción vitivinícola, la exploración y explotación de hidrocarburos, Tarija necesita ser escuchado.
Las ganas de trabajar están, estoy comprometido a llevar sus voces al poder y que los chapacos tengan mejores días, unidos lo vamos a lograr.
#CreoEnTarija #CreoEnVos","I BELIEVE IN TARIJA!

I believe in better days for Chura, a department that needs development opportunities, real decentralization needs to exploit tourism, wine production, exploration and exploitation of hydrocarbons, Tarija needs to be heard.
The desire to work are, I am committed to bringing their voices to the power and the chapacos have better days, together we will succeed.
#CreoEnTarija #CreoEnVos"
12,24/9/2020,"Somos Santa Cruz, somos la fuerza y la esperanza de Bolivia.

¡Felicidades Santa Cruz!

#CreoEnSantaCruz #CreoEnVos
#TuVozAlPoder","Santa Cruz us, we are the strength and hope of Bolivia.

Santa Cruz Congratulations!

#CreoEnSantaCruz #CreoEnVos
#TuVozAlPoder"
13,24/9/2020,"¡Gracias Cotoca!

Nada mejor que celebrar este 24 de septiembre que hacerlo con nuestra gente.

#CreoEnCotoca #CreoEnVos #TuVozAlPoder","Thank you Cotoca!

Nothing better than to celebrate this September 24th to do with our people.

#CreoEnCotoca #CreoEnVos #TuVozAlPoder"
14,24/9/2020,"Estos momentos los guardaré en mi corazón para siempre.

Hoy en la caravana a Cotoca se acercó a mi una señora para entregarme unos deliciosos dulces típicos. Ella buscó la manera de subirse a los hombros de alguien y a pesar de sus años logró alcanzar al camión.

No sé su nombre, pero su rostro quedará guardado en mi memoria con mucho cariño.

¡Gracias Cotoca!

#CreoEnCotoca #CreoEnVos","These moments keep in my heart forever.

Today in my caravan Cotoca a lady came over to give me some delicious sweets. She sought to get on someone's shoulders and despite his years he managed to reach the truck.

I do not know his name, but his face will be saved in my memory fondly.

Thank you Cotoca!

#CreoEnCotoca #CreoEnVos"
15,25/9/2020,"Estas son nuestras encuestas. Las encuestas de la gente que quiere cambio, las encuestas de la gente comprometida con un nuevo país. ¡Creo en un una nueva Bolivia, porque creo en mi gente, porque creo en vos!

#CreoEnMiGente #CreoEnVos #TuVosAlPoder","These are our surveys. Surveys of people who want change, surveys of people committed to a new country. I think a new one Bolivia, because I believe in my people, because I believe in you!

#CreoEnMiGente #CreoEnVos #TuVosAlPoder"
16,25/9/2020,"¡La Asociación del Transporte Pesado Internacional cree!

Gracias al sector transporte por darnos su apoyo, gracias por creer en mí y en este proyecto. Me comprometo a trabajar de la mano de ustedes para volver a Bolivia un país grande, productivo, con trabajo.

¡Unidos vamos a cambiar este país!

#CreoEnLosTransportistas #CreoEnVos #TuVozAlPoder","The Heavy Transport Association International believes!

Thanks to the transport sector support us, thank you for believing in me and this project. I pledge to work hand in hand for you to return to Bolivia a big country, productive, with job.

United we will change this country!

#CreoEnLosTransportistas #CreoEnVos #TuVozAlPoder"
17,26/9/2020,"¡La gente en las calles quiere cambio!

Gracias Cotoca por creer en nosotros, por creer en mejores días para nuestro país.

#CreoEnMiGente #CreoEnVos #TuVozAlPoder","People in the streets want change!

Cotoca Thank you for believing in us, for believing in better days for our country.

#CreoEnMiGente #CreoEnVos #TuVozAlPoder"
18,27/9/2020,"¡Hoy visitamos el norte integrado! Gracias San Juan de Yapacaní, Santa Fe, San Carlos, Buena Vista y Portachuelo, por recibirnos llenos de entusiasmo.

Tenemos un compromiso: llevaremos su voz al poder para crear un mejor país para todos. Nuestra fuerza son ustedes, la gente que cree en una nueva Bolivia.

#CreoEnMiGente #CreoEnVos #TuVozAlPoder","Today we visited the integrated North! San Juan de Yapacaní Thanks, Santa Fe, San Carlos, Buena Vista and Portachuelo, for having us full of enthusiasm.

We are committed: take your voice to the power to create a better country for all. Our strength is you, the people who believe in a new Bolivia.

#CreoEnMiGente #CreoEnVos #TuVozAlPoder"
19,27/9/2020,"¡El norte integrado de Santa Cruz cree en el cambio!

Hoy ratificamos nuestro compromiso con miles de bolivianos que nos han confiado su voz para llevarla al poder.

Tienen mi palabra, ¡una Bolivia nueva se está gestando!

#CreoEnMiGente #CreoEnVos #TuVozAlPoder","The Integrated North Santa Cruz believes in change!

Today we reaffirm our commitment to thousands of Bolivians who have entrusted us with his voice to carry power.

You have my word, a new Bolivia is brewing!

#CreoEnMiGente #CreoEnVos #TuVozAlPoder"
20,28/9/2020,"¡La juventud es protagonista del cambio!

¡La juventud es protagonista del cambio!

Nuestros jóvenes nos demostraron que en 21 días se puede cambiar la realidad de un país. Que se puede trabajar en equipo, que las diferencias terminan donde comienza nuestro amor por Bolivia.

Ese es el nuevo país que queremos, el de los jóvenes, el que lucha por libertad, el que no negocia sus principios, el que se rebela cuando los de siempre quieren burlarse del pueblo.

¡Bolivia es de ustedes! ¡Los jóvenes no son el futuro, son el presente de nuestro país!

#CreoEnLaJuventud #CreoEnVos #TuVozAlPoder","The youth is the protagonist of the change!

The youth is the protagonist of the change!

Our young people showed us that reality can be changed within 21 days of a country. You can work together, that the differences end where our love begins with Bolivia.

That's the new country that we, the youth, who struggle for freedom, which does not negotiate its principles, which rebels when always want to make fun of the people.

Bolivia is yours! The youth are not the future, are the present of our country!

#CreoEnLaJuventud #CreoEnVos #TuVozAlPoder"
21,28/9/2020,"Faltan 21 días para ir a votar

El año pasado, cuando dijimos que íbamos a parar este país muchos se burlaron de nosotros.
Creían que la gente se iba a cansar, creían que no éramos capaces de recuperar nuestra democracia, Bolivia estaba tan acostumbrada al abuso que ya había perdido la esperanza de volver a ser libre.

Así empezamos, con un megáfono en mano y ganas de luchar por nuestro presente y el futuro de nuestros hijos. Así empezamos, con una masa de jóvenes dispuestos a rebelarse ante sus padres con tal de hacer respetar su voto, con tal de vivir en un país libre.

Éramos unos cuantos en Santa Cruz, otros en La Paz, Cochabamba, Potosí, Beni, Pando, Chuquisaca, Tarija y Oruro pero teníamos convicción, teníamos esperanza , teníamos fe. Logramos unir al país con cantos y pititas, logramos lo que los viejos políticos nos dijeron siempre que era imposible.

Esta es la lucha del pueblo, esta es la fuerza que tiene la gente cuando se cansa de lo mismo, cuando se acobarda del abuso, cuando cree que vivir mejor es posible.

Hoy a 21 días de las elecciones, comenzamos la cuenta regresiva hacia una nueva Bolivia, hacia ese país que soñamos juntos.

#21D #CreoEnMiGente #CreoEnVos #TuVozAlPoder","Missing 21 days to go vote

Last year, when we said we were going to stop this country many mocked us.
They believed that people would get tired, they thought that we were not able to regain our democracy, Bolivia was so used to the abuse that had lost hope of ever being free.

So we started with a megaphone in hand and want to fight for our present and future of our children. So we started with a mass of young people willing to rebel against their parents just to enforce their vote, provided live in a free country.

There were a few in Santa Cruz, others in La Paz, Cochabamba, Potosi, Beni, Pando, Chuquisaca, Tarija and Oruro but we had conviction, we hope, had faith. We unite the country with songs and pititas, we accomplished what the old politicians always told us it was impossible.

This is the struggle of the people, this is the force that people have when they get tired of the same, when the abuse cringe when you think that life is best.

Today at 21 days before the election, the countdown has started towards a new Bolivia, to the country that we dream together.

# 21D #CreoEnMiGente #CreoEnVos #TuVozAlPoder"
22,28/9/2020,"21 días para soñar
21 días para defender lo que hasta hoy construimos
21 días para terminar lo que comenzamos en las rotondas con pititas.
Préstame tu voto y en 5 años te devolveré una Bolivia productiva, con salud y empleo.

#21D #CreoEnMiGente #CreoEnVos #TuVozAlPoder","21 days to dream
21 days to defend what until today build
21 days to finish what we started at roundabouts with pititas.
Lend me your vote and in 5 years will restore a productive Bolivia, with health and employment.

# 21D #CreoEnMiGente #CreoEnVos #TuVozAlPoder"
23,29/9/2020,"¡Llegamos a Potosí!

Gracias a su gente valiente por comprometerse con el cambio, gracias por creer en nosotros. Unidos lograremos crear una nueva Bolivia, una Bolivia productiva y con empleos.

#CreoEnPotosi #CreoEnVos #TuVozAlPoder","We arrived in Potosi!

Thanks to its brave people commit to change, thank you for believing in us. States succeed in creating a new Bolivia, Bolivia and productive jobs.

#CreoEnPotosi #CreoEnVos #TuVozAlPoder"
24,30/9/2020,"¿Y esto es el 1%?

En Potosí llenamos las calles con el 1% de la gente 😂.

Le tumbamos la mentira, una vez más, a quienes han intentado manipular nuestro voto durante años. Esa vieja clase política y sus cómplices, nunca más direccionarán nuestro futuro con encuestas truchas.

¡Gracias al pueblo valiente y guerrero de Potosí por su apoyo, gracias por comprometerse con el país y la democracia!

Los bolivianos nos merecemos una mejor Bolivia, una Bolivia sin mentiras y sin malas mañas. Tienen mi palabra de trabajar hasta el cansancio para lograrlo.

¡Nada nos detiene! ¡Nadie nos para!

#CreoEnPotosí #CreoEnVos #TuVozAlPoder",
25,30/9/2020,"LA MANIPULACIÓN DE LAS ENCUESTAS

El fraude que monto el MAS es complejo y abarca muchas cosas: manipulación informativa, alteración de actas físicas, voto obligado, inscripciones irregulares de votantes en el extranjero, encuestas reguladas, entre otras.

Peleamos mucho para que se investiguen y corrijan todas esas irregularidades, pero el pactismo y los intereses de la clase política ganaron esa batalla y no se hizo nada en contra de esa cultura fraudulenta instalada por el MAS.

Es más, empezaron a usar las encuestas reguladas, que fueron parte del montaje del fraude masista, para el beneficio de la vieja política. Hoy, hay partidos y candidatos que en lugar de buscar la persuasión del votante, apelan a sus vínculos con empresas encuestadoras y medios para direccionar e imponer tendencias en el voto.

Las encuestas públicas son una herramienta poderosa, porque pueden llegar a alterar la percepción de la realidad. Una encuesta manipulada es una mentira que lastima la democracia.

Las encuestas no deberían estar restringidas, pero sí, quienes las alteren deberían ser sancionados.

Que no te manipulen, que no te mientan. Cuando veas los números en la pantalla de algunos medios de comunicación, recuerda que la decisión, el poder del voto y por ende, el destino de Bolivia, está en tus manos y no en los negociados y los intereses privados que usan el juego de las encuestas para direccionar el voto.

Hay un tema de fondo en esta elección: tenemos que votar por una opción que sea capaz de reconstruir la democracia. El MAS y sus métodos autoritarios siguen estando incrustado en muchas instituciones públicas y lo van a seguir estando después del 18 de octubre. Por eso, tu elección tiene que estar orientada a respaldar al equipo de personas que puedan hacerle frente a esa realidad.","HANDLING OF POLLS

Fraud amount MAS is complex and involves many things: information manipulation, alteration of physical acts, forced voting, irregular voter registration abroad, regulated surveys, among others.

We fought a lot to investigate and correct all the irregularities, but the wheeling and dealing and interests of the political class won that battle and nothing was done against such fraudulent culture installed by the MAS.

It is more regulated started using surveys, which were part of the assembly of the MAS fraud for the benefit of the old politics. Today, there are parties and candidates instead of seeking voter persuasion, appeal to their links with pollsters and media companies to address and impose trends in the vote.

Public surveys are a powerful tool because it can alter the perception of reality. A manipulated survey is a lie that hurts democracy.

Surveys should not be restricted, but who the alter should be punished.

You do not handle, you do not lie. When you see the numbers on the screen of some media, remember that the decision, the power of the vote and therefore the fate of Bolivia, is in your hands and not traded and private interests that use the game of to direct the voting polls.

There is an underlying theme in this election: we have to vote for an option that is able to reconstruct democracy. MAS and its authoritarian methods remain embedded in many public institutions and they will remain after October 18. Therefore, your choice should be geared to supporting the team of people who can cope with that reality."
26,2020-10-01,"¡Celebramos el Día Nacional del Árbol trabajando!

Hoy nuestro equipo de Santa Cruz entregó 7000 plantines a los candidatos de distintos municipios y distritos para que puedan hacerle honor a esta fecha especial plantando nuevos árboles.

¡Es con hechos!

#CreoEnMiGente #CreoEnVos #TuVozAlPoder","We celebrate National Day of the Tree work!

Today our team of Santa Cruz gave plantines 7000 candidates from various municipalities and districts so that they can make this day special honor planting new trees.

It is with facts!

#CreoEnMiGente #CreoEnVos #TuVozAlPoder"
