,created_at,original,translated
57,2020-10-12,"Me llena el corazón de satisfacción ver como un pueblo que tuvo que callar durante años hoy sale a la calle a decir: creo en una nueva Bolivia. Gracias Pando por llenar las calles de gente comprometida con Bolivia, gracias creer en nuestro proyecto de verdadero cambio. Este 18 de octubre volveremos a votar por convicción y con valor después de más de 14 años de dictadura. #CreoEnPando #CreoEnVos #TuVozAlPoder","I fill my heart good to see as a people who had to remain silent for years now goes out to say: I believe in a new Bolivia. Thanks Pando to fill the streets of people committed to Bolivia, through believing in our project real change. October 18th we will vote for conviction and courage after more than 14 years of dictatorship. #CreoEnPando #CreoEnVos #TuVozAlPoder"
58,2020-10-12,¡DIGANME SI MI GENTE NO ES BELLA! 🤣,
59,2020-10-12,"Ustedes me enseñaron que no tenemos derecho a cansarnos, que no tenemos derecho a rendirnos, que los jóvenes son el presente y el futuro del país. Gracias Cobija, gracias Pando. ¡Gracias por creer en mi, yo creo en ustedes! #CreoEnMiGente #CreoEnVos #TuVozAlPoder","You taught me that we have no right to get tired, we have no right to surrender, that young people are the present and the future of the country. Thanks Cobija, Pando thanks. Thank you for believing in me, I believe in you! #CreoEnMiGente #CreoEnVos #TuVozAlPoder"
60,2020-10-12,"¿Sabías que a pesar de la pandemia la economía de Santa Cruz siguió creciendo? Lo que hicimos bien en Santa Cruz, es lo que quiero llevar a todo Bolivia. Para que vos que estás pasando necesidades tengas trabajo, para que tus hijos tengan un mejor futuro, para que los jóvenes puedan crear sus propios emprendimientos. Esa es la Bolivia que queremos construir, la productiva, la que cuida tu economía, la que genera oportunidades. Prestame tu voto, en 5 años te devolveré un nuevo país. #CreoEnMiGente #CreoEnVos #TuVozAlPoder","Did you know that despite the pandemic's economy continued to grow Santa Cruz? What we did well in Santa Cruz, it is what I carry around Bolivia. So you're going to have work requirements, so that your children have a better future for young people to create their own businesses. That's the Bolivia we want to build, productive, you care for your economy, generating opportunities. Lend me your vote, in 5 years will restore a new country. #CreoEnMiGente #CreoEnVos #TuVozAlPoder"
61,2020-10-12,"¡Llegamos a Trini! Gracias a esta hermosa tierra por recibirnos con tanto cariño. Hoy les dejé mi palabra empeñada: no sólo vamos a ganarle a la vieja política, vamos a acabar con el poder de los corruptos, vamos a meter preso hasta el último delincuente suelto. Se acabó el festín de quienes viven en abundancia a costa de la miseria de nuestra gente. Les pido su voto prestado por 5 años, si en 21 días logramos lo que los concubinos del MAS no pudieron hacer en 14, les aseguro que en una gestión CAMBIAMOS BOLIVIA. ¡Gracias Trinidad, gracias Beni! #CreoEnMiGente #CreoEnVos #TuVozAlPodee","We arrived in Trini! Thanks to this beautiful land for welcoming us so warmly. Today I left them my word given: not only will we beat the old politics, we will end the power of corrupt, let's get to the last imprisoned felon loose. It ended the feast of those living in abundance at the expense of the misery of our people. I ask for your vote given for 5 years, if within 21 days we what the concubines of the MAS could not do in 14, I assure you that in CAMBIAMOS BOLIVIA management. Thank Trinidad, Beni thanks! #CreoEnMiGente #CreoEnVos #TuVozAlPodee"
62,2020-10-13,"¡Vinimos a hacer historia, no a ser más de lo mismo! Vamos a construir una nueva Bolivia de la mano de la gente, una Bolivia para los jóvenes, una Bolivia con oportunidades, productiva, con empleo. Llegó nuestra hora, la hora de la gente, la de las mujeres y los jóvenes, juntos vamos a luchar hasta lograr cambiar Bolivia. #CreoEnBeni #CreoEnVos #TuVozAlPoder","We came to make history, not to be more of the same! We will build a new Bolivia hand people a youth Bolivia for a Bolivia with opportunities, productive, employed. It came our time, when people, women and young people, together we will fight to achieve change Bolivia. #CreoEnBeni #CreoEnVos #TuVozAlPoder"
63,2020-10-13,"MONTERO CREE La valentía los caracteriza, esta tierra de héroes, gente trabajadora y luchadora. GRACIAS POR CREER, gracias por confiar en este proyecto, sin duda llena el corazón de fe y alegría recibir tanto cariño. ¡VIVA MONTERO, VIVA BOLIVIA! #CreoEnMontero #CreoEnMiGente #TuVozAlPoder","MONTERO CREE Courage characterizes this land of heroes, working people and feisty. Thank you for believing, thank you for trusting this project certainly fills our hearts with faith and joy to receive so much love. MONTERO VIVA, VIVA BOLIVIA! #CreoEnMontero #CreoEnMiGente #TuVozAlPoder"
64,2020-10-14,🐜 ¡Nos vemos en el Cristo!🐜 ⏲15:00 hrs. #CreoEnMiGente #CreoEnVos #TuVozAlPoder,
65,2020-10-14,"Este domingo 18 vamos a dejar atrás a la vieja política, vamos a votar sin miedo, vamos a votar con fe y esperanza. Creo en vos y creo en tu voto que es la fuerza del cambio. Este 18, votá por una nueva Bolivia. #CreoEnMiGente #CreoEnVos #TuVozAlPoder","Sunday 18 we will leave behind the old policy, we will vote without fear, we will vote with faith and hope. I believe in you and believe in your vote that is the strength of the change. This 18 vote for a new Bolivia. #CreoEnMiGente #CreoEnVos #TuVozAlPoder"
66,2020-10-14,"Santa Cruz, perdón por el tráfico de hoy ¡Estamos cambiando el país! #CreoEnVos #CreoEnMiGente #TuVozAlPoder","Santa Cruz, sorry for today's traffic We are changing the country! #CreoEnVos #CreoEnMiGente #TuVozAlPoder"
67,2020-10-14,"¡GRACIAS SANTA CRUZ, GRACIAS BOLIVIA! Este cabildo móvil nos demostró hoy que se acabó el miedo, se acabó la vieja política, llegó la hora de los jóvenes, de nuestras mujeres, ¡llegó la hora de la gente! Gracias a todos los que salieron a la calle a reafirmar su compromiso con Bolivia. Este 18 de octubre vamos a votar con esperanza, vamos a votar con fe. ¡Gracias por creer; yo creo en ustedes, porque son la fuerza del cambio! #CreoEnMiGente #CreoEnVos #TuVozAlPoder","THANK SANTA CRUZ, BOLIVIA THANK YOU! This mobile council showed us today that the fear is over, the old politics is over, when young people, our women, came when people came! Thanks to all who took to the streets to reaffirm their commitment to Bolivia. October 18th we will vote with hope, we will vote with faith. Thanks for believing; I believe in you, because they are the force of change! #CreoEnMiGente #CreoEnVos #TuVozAlPoder"
68,2020-10-14,"¡Este equipo de jóvenes es tan hermoso que se inventaron un cabildo móvil 😂😎! ¡Santa Cruz hoy demostró en las calles que se cayó la dictadura de las encuestas! Se acabó el tiempo en que los de siempre jugaban a sembrar pánico y llevarnos como ovejas a votar por miedo. Este 18 de octubre Bolivia votará con ilusión después de muchos años, votará con fe y esperanza. Les di mi palabra hoy a los pies del Cristo: ¡vamos a luchar hasta cambiar este país! Gracias a toda esa gente hermosa que nos acompaño hoy en las calles, gracias por las horas de espera, gracias por el entusiasmo, gracias por comprometerse con el cambio. ¡Este domingo 18 de octubre, animate a votar con el corazón! #CreoEnMiGente #CreoEnVos #TuVozAlPoder",
